{
  "$schema": "https://json-schema.org/draft/2020-12/schema",
  "$id": "https://cosa.local/schemas/business-event-envelope/v1",
  "title": "BusinessEventEnvelope",
  "type": "object",
  "required": ["eventId", "eventType", "schemaVersion", "occurredAt", "workspaceId",
               "aggregateType", "aggregateId", "correlationId", "actor", "producer",
               "classification", "payload"],
  "additionalProperties": false,
  "properties": {
    "eventId":       { "type": "string", "format": "uuid" },
    "eventType":     { "type": "string", "pattern": "^[a-z]+\\.[a-z_]+\\.[a-z_]+\\.v[0-9]+$" },
    "schemaVersion": { "type": "integer", "minimum": 1 },
    "occurredAt":    { "type": "string", "format": "date-time" },
    "workspaceId":   { "type": "string", "minLength": 1 },
    "aggregateType": { "type": "string", "minLength": 1 },
    "aggregateId":   { "type": "string", "minLength": 1 },
    "correlationId": { "type": "string", "minLength": 1 },
    "causationId":   { "type": "string", "minLength": 1 },
    "actor": {
      "type": "object", "required": ["kind", "id"], "additionalProperties": false,
      "properties": {
        "kind": { "enum": ["user", "agent", "system"] },
        "id":   { "type": "string", "minLength": 1 }
      }
    },
    "producer": {
      "type": "object", "required": ["service", "version"], "additionalProperties": false,
      "properties": {
        "service": { "type": "string", "minLength": 1 },
        "version": { "type": "string", "minLength": 1 }
      }
    },
    "classification": { "enum": ["internal", "confidential", "restricted"] },
    "payload": { "type": "object" }
  }
}
